{
  "blockers": [],
  "checks": [
    {
      "details": "All IDs are stable uplb:* identifiers.",
      "name": "stable-feature-ids",
      "status": "pass"
    },
    {
      "details": "missing=0 unknown=0",
      "name": "provenance-completeness",
      "status": "pass"
    },
    {
      "details": "invalid=0",
      "name": "geojson-geometry-types",
      "status": "pass"
    },
    {
      "details": "rejected=0 needsReview=0",
      "name": "geometry-validity",
      "status": "pass"
    },
    {
      "details": "Restricted/uncertain sources are not permitted to silently enter canonical data: source:dem:srtm-baseline",
      "name": "rights-gate",
      "status": "warning"
    }
  ],
  "decision": "conditional",
  "discrepancies": [],
  "id": "validation:canonical-campus-v1",
  "inputRevisions": {
    "canonicalVersion": "canonical-v1",
    "osm": "sha256:9f766739c1ad0088170c708d222c246b47b4dc684120f1f57f252d6f290f6142"
  },
  "measurements": {
    "candidateCount": 10293,
    "canonicalCount": 3,
    "featureCount": 3,
    "featureTypes": {
      "building": 1,
      "landmark": 2
    },
    "pendingReviewCount": 0,
    "sliceCandidateCount": 1911
  }
}
